{
  "question": "What are the two main reasons a scraper might get blocked, and what do the exclusion rules represent?",
  "answer": "A scraper might get blocked for numerous reasons. These rules are not a form of access authorization.",
  "citations": [
    {
      "span": "A scraper might get blocked for numerous reasons",
      "chunk_id": "chunkA"
    },
    {
      "span": "These rules are not a form of access authorization",
      "chunk_id": "chunkC"
    }
  ],
  "retrieved_chunks_count": 2,
  "grounded_sha256": [
    "deadbeefdeadbeefdeadbeefdeadbeefdeadbeefdeadbeefdeadbeefdeadbeef",
    "beefdeadbeefdeadbeefdeadbeefdeadbeefdeadbeefdeadbeefdeadbeefdead"
  ],
  "generated_utc": "2026-09-12T06:25:57Z",
  "stale_flag": false
}